id,sentence,tense/aspect
1002,The lamp was old .,past
1003,The pigs ate slop .,past
1005,The televisions were all turned on .,past
1008,The rabbits ate the carrots .,past
101,The zippers were unzipped .,past
1014,The turtles were safe .,past
1015,The shark was graceful .,past
1017,The guitars were on sale .,past
1019,The fence was made of stone .,past
1020,Marbles were all over the floor .,past
1023,A towel was crumpled on the floor .,past
1026,The knife was covered in jelly .,past
1027,The tires were flat .,past
103,The shirts were washed .,past
1037,The penguins waddled .,past
1039,The light bulb was green .,past
104,The cheetahs had spots .,past
1042,The peacocks strutted .,past
1047,The lamp was broken,past
1054,The sharks stayed away from the dolphins,past
1057,The pig rolled in the mud,past
106,The towel was wet .,past
1065,The tire almost fell off of my car,past
1074,The pigeon flew to the roof of the building,past
1078,The turtle poked its head out of its shell,past
1080,A cat lay in the sun,past
1088,The owls hooted all night,past
1089,The dog was outwitted by the fox,past
1092,The zipper got stuck,past
1095,A bear went through our food,past
1096,The boat sailed away,past
1097,The cows drank water,past
1103,A kite flew in the wind,past
1104,The cats fought outside,past
1105,The penguin sat in the snow,past
1106,The pig ran around the farm,past
1108,Rabbits ate carrots and lettuce,past
1109,The pianos were played,past
1110,The foxes jumped over the fence,past
1114,Cheetahs ran quickly through the wild,past
1116,A marble rolled away on the floor,past
1119,The lamps were turned off,past
112,The lion roared .,past
1120,The squirrel ate nuts,past
1121,Camels drank water in the desert,past
1123,The kangaroos ate in the field,past
1127,A toilet flushed,past
1129,The lion roared at the other lion,past
1133,The pigeon flew away,past
1137,The computer screen froze,past
1139,The dolphins played at the aquarium .,past
1140,The pigeon fell out of the sky .,past
1142,A turtle moved slowly across the grass .,past
1145,The fox ran after the hound .,past
1147,The penguins kept warm by hugging .,past
115,The guitars were tuned .,past
1150,The peacocks had different color tails .,past
1151,A butterfly flew around the flowers .,past
1153,A cheetah ran fast across the field .,past
1154,The elephants were hungry for peanuts .,past
1156,The owl sat quietly on top of a tree in the night .,past
1160,The pandas played at the zoo .,past
1163,A guitar was used to play the song .,past
1166,The boat hit the iceberg .,past
1167,The marble floor was very clean .,past
1169,The skunk smelled really bad .,past
117,A turtle hid in its shell .,past
1170,The clocks hands moved slowly .,past
1174,The knife was used to cut vegetables .,past
1175,The lions moved in packs .,past
118,The squirrel ate nuts .,past
1180,The pianos played a lovely melody .,past
1181,The couch was very relaxing .,past
1182,A camel moved slowly across the desert .,past
1186,A gorilla wanted a banana to eat .,past
1187,A rabbit ate some carrots .,past
1188,The cheetahs were nearby .,past
1189,Owls screeched .,past
119,The camels were thirsty .,past
1190,The penguin was cold .,past
1193,The tires were new .,past
1195,The lamps were fancy .,past
1196,The bed was comfortable .,past
1197,The lion roared .,past
1198,The gorillas were big .,past
1202,A shirt was bought .,past
1204,A computer was sold .,past
1208,A toilet was used .,past
1209,The bears were hungry .,past
1210,Towels were brought in .,past
1211,The piano was displayed .,past
1212,A guitar was played .,past
1213,The pig ate mush .,past
1214,Kites were flown high .,past
1216,A boat was sailing by .,past
1217,The car was parked nearby .,past
1218,Foxes were seen .,past
122,The chair was soft .,past
1220,The televisions were on .,past
1221,The trumpet was played loudly .,past
1224,The marbles were new .,past
1225,The knife was used during dinner .,past
1226,The bicycles were stolen .,past
1229,The couches were imported .,past
123,The marble was round .,past
1230,A skunk smelled .,past
1231,The cat jumped on the furniture .,past
1232,A football was thrown .,past
1234,The kangaroo jumped .,past
1236,A marble A marble rolled across the floor .,past
1245,A shark A shark was spotted off the end of the pier .,past
1248,The cheetahs The cheetahs lounged in the tall grass .,past
125,The kangaroo jumped .,past
1253,The foxes The foxes played in the meadow as we watched .,past
1256,The cars The cars involved in the accident were totaled .,past
1257,The dogs The dogs barked at the mailman .,past
1262,The boats The boats raced for the finish line at the annual race .,past
1274,A dolphin A dolphin got caught in our fishing nets .,past
128,The penguins were extinct .,past
1282,The lamps all went out at once .,past
1284,A pigeon landed on the park bench .,past
1285,The clock struck midnight .,past
1286,The bed was very comfortable .,past
1288,Towels hung from the rack .,past
1289,A penguin was brought to our zoo last week .,past
129,The knife was sharp .,past
1291,The couches were lined up in a row .,past
1292,The dog brought me his ball .,past
1293,The footballs were used often .,past
1294,The lions lazed about .,past
1296,The fox sprang away quickly .,past
1297,The kites flew high .,past
1299,A pig looked at me from afar .,past
1300,The dolphin was very playful with its trainer .,past
1301,A piano sat in the middle of the music room .,past
1302,The gorilla beat his chest .,past
1303,The squirrels climbed the trees .,past
1305,The guitars all sounded great .,past
1308,A butterfly landed on my shoulder .,past
1309,The knives were sharpened yesterday .,past
1310,The skunks hid in the tall grass .,past
1311,The cheetah demonstrated its speed .,past
1313,The zipper got stuck on my clothes .,past
1314,The peacocks showed their plumage .,past
1318,The owls were noisy at night .,past
1319,A boat sat in the middle of the lake for hours .,past
132,The butterflies flew around .,past
1322,The toilet overflowed once in a while .,past
1323,The pandas seemed playful in the exhibit .,past
1326,Cows were everywhere in the country .,past
1328,The computer refused to turn on .,past
133,The pig was sloppy .,past
1330,The tire Went flat,past
1331,Kites Soared above,past
1333,A boat Cruised along the coast,past
1342,A skunk Sprayed his smell,past
1345,The dog Slept all day,past
1347,The television Stayed on all night,past
1349,The chairs Matched the table,past
1351,The sharks Ate the fish,past
1352,Towels Were folded on the counter,past
1353,The elephant Went to the water,past
1355,The penguins Skidded across the snow,past
1356,A panda Ate bamboo,past
1358,A couch Sagged under weight,past
1359,Bears Ate the honey,past
1361,The kangaroo Jumped over the fence,past
1362,Cheetahs Sprinted up the path,past
1366,The pigeons Ate all of the crumbs,past
137,The bear was hungry .,past
1370,The bed Creaked when I jumped on it,past
1371,The owls Hooted from their tree,past
1372,Butterflies Fluttered around the flowers,past
1376,Pigs Snorted in their cage,past
1377,A car Came to a stop,past
1380,The skunks The skunks were in the yard,past
139,The cars were fast .,past
140,A tire went flat .,past
141,The boats were sailing .,past
142,The lamp was on .,past
1422,The pig The pig was in the pen,past
143,The owls hooted at night .,past
144,A kangaroo jumped across the road .,past
145,The bed was made for the guest .,past
1459,The sharks turned over the small boat .,past
146,Squirrels gathered nuts for the winter .,past
1463,The boat came untied at the dock .,past
1480,The pigeon was on top of the building .,past
1487,A skunk was out in the woods .,past
149,The television was turned onto the local news .,past
1490,The piano was in the corner .,past
1492,The elephant and the baby elephant were fun to see .,past
1493,The penguins looked cute in the movie .,past
1496,A cat was outside of our house .,past
1497,The cows were in the field .,past
150,The dogs barked at the mailman .,past
151,The gorilla scratched himself .,past
1511,The shirt looked very good on him .,past
1512,A marble was found on the floor .,past
1514,The knife was found at the scene .,past
1515,A bear was spotted on the hiking trail .,past
1518,A tire was flat and I could not leave .,past
152,The fences kept out the squirrels .,past
153,A clock was striking midnight .,past
154,An elephant trampled the ground .,past
155,Boats were anchored in the harbor .,past
156,The dolphin jumped into the air .,past
1568,The sharks circled the blood in the water .,past
157,Lamps were turned on at the sound of shouting .,past
1571,A clock ticked on the wall .,past
1572,Knives flew through the air at the target .,past
1573,The light bulb was blown .,past
1575,The footballs sat in the closet .,past
1577,The shirt had a stain on the front .,past
1579,The cat slept on the couch .,past
158,A light bulb was fried and needed replacing .,past
1580,The bear growled at the man .,past
1581,A kite fell from the sky .,past
1582,Chairs surrounded the table .,past
1583,The fox sneaked through the forest .,past
1585,The owls sat in the tree .,past
1586,The penguins waddled over the ice .,past
1587,Butterflies flew through the garden .,past
1588,A piano sat in the corner .,past
159,The car was stopped by the police officer .,past
1593,The pig rolled in the mud .,past
1594,The couches were old and torn .,past
1597,The kangaroos jumped up the trail .,past
1598,A marble rolled down the hill .,past
1599,The turtles had hard shells .,past
1602,Cars drove quickly down the highway .,past
1603,The toilet was extremely dirty .,past
1607,The zipper was brokwn on my jeans .,past
1608,A squirrel climbed up the tree .,past
1609,The bicycles were brand new .,past
161,The butterfly flew over the hill .,past
1611,Dogs howled at the moon .,past
1612,The televisions were on sale .,past
1613,A cheetah ran across the plain .,past
1614,The skunk sprayed the dog .,past
162,The peacocks flashed their feathers to attract a mate .,past
163,A knife was in the cupboard .,past
164,The footballs were spiked into the ground .,past
165,A computer was turned on and downloading software .,past
166,A pig oinked in joy at the offering of apples .,past
1666,The kite got blown away by the wind,past
1671,The elephant was huge,past
1673,The rabbits kept hopping away .,past
168,Cheetahs raced across the plains .,past
1684,The cars really looked beautiful and fast .,past
1690,The butterfly had a beautiful color on its wings,past
1694,The skunk smelled really bad,past
1695,The couches were torn to shreds .,past
1696,The toilet needed a good cleaning,past
1704,The pig ate too much slop .,past
171,The guitars were mounted on the wall .,past
1714,A trumpet loudly signaled the start of the horse race .,past
1715,Tires were loaded on the truck for recycling .,past
1718,A clock started ticking without having been wound first .,past
1719,Toilets overflowed in the company 's restroom .,past
1720,The beds were pushed together suspiciously .,past
1723,A bear rummaged through her garbage can .,past
1724,The cheetahs raced each other across the steppe .,past
1727,The pigeon landed on the top of the government building .,past
1728,The zippers on the sleeping bags were all broken .,past
173,Towels were laid on the ground at the beach .,past
1730,Penguins waddled for months across the ice to the sea .,past
1731,A light bulb broke when it would not unscrew properly .,past
1732,An elephant swung his tusk dangerously at the zoo keeper .,past
1733,The cars gleamed in the show room after being waxed .,past
1735,The peacock had multi-colored feathers .,past
1738,The piano had one dead key that would n't play .,past
1740,The lamps were purchased as part of a matching set .,past
1742,Knives were thrown by the performer at the apple on his assistant 's head .,past
1744,The owls landed on our chimney every night for months .,past
1745,The marble rolled under the sofa .,past
1749,A towel was ripped in the washing machine .,past
175,A shark caught a seal .,past
1750,Bicycles were for sale in the sports shop .,past
1754,The couches made of leather were cold in the winter .,past
1755,Lions stalked their prey in the jungle .,past
1757,The dog accidentally fell into the swimming pool .,past
1760,The pianos were played together,past
1761,A boat glided over the reef,past
1762,The chairs were arranged in a circle,past
1763,The dolphin aided the stranded fisherman,past
1765,Cars drove along the lines,past
1766,Marbles were never returned,past
1767,The fence needed mending soon,past
1768,The camels drank their fill,past
1769,A toilet was flushed after repair,past
1770,The butterfly fluttered upwards slowly,past
1771,A shark ate the scuba diver,past
1772,The rabbit ate lots of carrots,past
1774,The turtles swam away from shore,past
1775,Penguins swam under ice,past
1776,A couch slouched in the middle,past
1777,The fox jumped over the dog,past
1779,The kites flew in unison,past
178,An owl hooted into the night .,past
1780,A lion roared on cue,past
1781,Bicycles were kept in racks,past
1782,The zipper got stuck at an awkward position,past
1783,The light bulbs were changed for CFLs,past
1784,The cat stalked the mouse,past
1785,A shirt was worn unbuttoned,past
1786,The cheetahs ran after the gazelle,past
1788,The peacocks strutted around seriously,past
1789,Cows mooed in the field,past
179,The cat meowed for food .,past
1790,A guitar was strummed onstage,past
1791,Beds were slept in,past
1792,Owls hooted at the squirrels bothering them,past
1795,The football was thrown far,past
1796,Knives cut the vegetables smoothly,past
1797,The squirrels hoarded for winter,past
1798,The trumpet blew a fierce blast,past
1799,A kangaroo jumped away from the dog,past
18,A football was tossed at me .,past
180,The rabbits jumped around on the lawn .,past
1800,The towels were left on the floor,past
1801,The tire blew up on impact,past
1802,The bear growled at the intruder,past
1803,Televisions showed max headroom,past
1804,An elephant mourned the dead,past
1805,Pigeons flew up at the thrown crumbs,past
1806,The bicycles zoomed in and out of traffic .,past
1808,A skunk lifted its tail .,past
1811,The towel was wet .,past
1812,An elephant splashed water on his back .,past
1816,The dolphin leaped into the air .,past
1817,Pigeons flew over our heads .,past
1819,Guitars were strummed .,past
1820,The chair was tipped over .,past
1822,The foxes evaded the hounds .,past
1824,The footballs were thrown .,past
1825,A television was on in the background .,past
1826,The butterfly landed on the flowers .,past
1828,The cats meowed .,past
1829,The cow ate grass .,past
183,The zipper was zipped all the way .,past
1830,Lions roared loudly .,past
1831,A car ran a stop sign .,past
1832,The knives were sharp .,past
1834,The marble got captured by the opponent .,past
1835,The bears slumbered .,past
1836,A bed was made .,past
1837,A cheetah ran fast .,past
1838,Boats floated silently .,past
1839,The penguin waddled across the ice .,past
1841,The zipper hissed closed .,past
1844,Lamps were lit .,past
1845,A panda looked for leaves to eat .,past
1846,The kangaroos hopped away .,past
1847,Peacocks flashed their tails .,past
1848,The turtles moved slowly .,past
1849,The couch was covered with a soft blanket .,past
185,The skunks sprayed each other .,past
1850,The computers hummed quietly .,past
1852,The butterfly spread its colorful wings,past
1856,The shirt was very dirty,past
1857,A light bulb was burnt out,past
1858,The pigs smelled,past
1859,The marbles rolled under the table,past
186,The camel was a symbol for a popular cigarette brand .,past
1860,The boat sank to the bottom of the ocean,past
1862,The trumpet was old,past
1863,The toilet was clogged,past
1864,A peacock spread its wings,past
1866,The bicycles had flat tires,past
1868,The knives were very sharp,past
187,Foxes ran from the hunters .,past
1873,The dolphin jumped through the air,past
1877,The cow ate grass,past
1879,The guitars strings were broken,past
188,Turtles wandered through the grass .,past
1880,The chair was turned over,past
1884,The cheetahs ran fast through the brush,past
1886,The cat ate the mouse,past
1888,The squirrels chased each other,past
189,The tires screeched against the ground .,past
1890,The tire was flat,past
1891,The footballs were all flat,past
1893,The gorillas were at the zoo,past
1894,The skunk ran from the dog,past
1895,Clocks ticked at noon,past
1896,A marble hit me in the head .,past
1898,The bicycle was stolen .,past
1907,A light bulb was replaced .,past
191,A cow was tipped over my micheivous children .,past
1912,A fox chased the rabbit .,past
1914,The panda ate the bamboo .,past
1917,The elephants escaped the ivory hunters .,past
1918,A cat scratched at the door .,past
1919,A car was stolen from the parking lot .,past
1923,The toilets were full of urine .,past
1924,The bear ate the old woman .,past
1926,A tire rolled down the hill .,past
1927,The squirrel ate a nut .,past
1930,The kangaroos put the joeys in their pouches .,past
1931,The dogs barked furiously .,past
1933,A lion ate the baby goat .,past
1937,The television blew up .,past
1938,The zipper on the coat was stuck .,past
1939,The towels were left !!! wet and soggy !!! on the bathroom floor .,past
194,The skunks stayed away from the humans except to raid their garbage cans .,past
1940,The rabbits stole carrots and cabbages from the farmer 's fields .,past
1941,Guitars lined the walls of the music shop .,past
1942,The squirrel gathered nuts for the winter .,past
1943,A dog frolicked in the grass !!! nipping at the butterflies .,past
1944,The chairs were lined up symmetrically against the wall .,past
1946,Footballs and basketballs were brought out in the gym glass .,past
1947,A car drove slowly down the street .,past
195,The bear was barely visible !!! like a shadow in the moonless night .,past
1951,A toilet stood in the middle of the bathroom .,past
1953,The beds looked comfortable to the hotel guests .,past
1954,The marble slowly made its way through the Mouse Trap course .,past
1955,A kite took a sharp dive to the ground when the wind let up .,past
1957,The bicycle had a rusty chain and a flat tire .,past
1959,A knife was left behind at the crime scene .,past
196,The footballs were specially designed for professional competition .,past
1960,The fences were in need of repair .,past
1961,The elephant helped its young out of the water .,past
1962,Turtles slowly made their way across the sandy beach .,past
1963,A shark slowly swam underneath the fishing boat .,past
1965,The cheetahs were curled up sleeping .,past
1967,The pigeon in the children 's book shared a cookie with a duckling .,past
1968,The skunks chased each other through the flower field .,past
1970,A fox and a hound became friends .,past
1972,The lamps were on in the room .,past
1973,Shirts were scattered all around the bedroom floor .,past
1974,A butterfly fluttered across the blue sky .,past
1976,The peacock strutted across the zoo .,past
1978,The television was on !!! loudly blaring the sports game .,past
1979,Couches filled the furniture store showroom .,past
1980,The dolphins skimmed through the water .,past
1982,The camels slowly made their way across the desert .,past
1983,A boat steadily crossed the lake .,past
1984,The cat lapped up milk from its dish .,past
1987,Butterflies lit on her hand,past
1988,The lamp was bright,past
1990,The knife was very sharp,past
1991,A squirrel hid some nuts .,past
1993,The cows were hungry,past
1997,The shark swam away,past
1999,The turtles walked slowly,past
200,The lamps in the suburban houses all went out !!! one by one .,past
2000,The pigeon flew up,past
2002,The fence was high,past
2003,The bears were in the park,past
2005,The footballs flew overhead,past
2006,The tire blew out,past
2007,The peacocks posed proudly,past
2009,A dog chased the cat,past
2010,The dolphin jumped in the air,past
2011,Cars came up the road,past
2013,The pianos were for the concert .,past
2014,The towel was wet,past
2017,A pig got out of the pen,past
2019,A bed was in the room,past
2020,The zipper was stuck,past
2023,The fox ate the grapes,past
2024,A lion roared,past
2026,The skunk made an awful smell,past
2027,A clock was on the wall,past
2030,The kites flew high,past
2032,The gorillas The gorillas looked pretty calm .,past
2035,Kites Kites were flown by the children on the windy day .,past
2037,A trumpet A trumpet blared in the distance .,past
2038,Pandas Pandas chewed bamboo in their cages at the zoo .,past
2039,A fox A fox sprinted across the field .,past
2040,A shark A shark ripped the flesh to shreds .,past
2041,The penguin The penguin waddled over the snowy hill .,past
2042,The clocks The clocks all struck midnight simultaneously .,past
2045,The rabbit The rabbit bounced up and down in the grass .,past
2047,The fence The fence was covered in moss .,past
2048,The cheetah The cheetah was pretty fast .,past
2049,The televisions The televisions blared annoyingly .,past
2051,The couches The couches were smelly .,past
2052,An elephant An elephant picked a leaf off of a tree with its trunk .,past
2055,The lion The lion roared at me ferociously .,past
2056,The pigs The pigs oinked with pleasure in the mud .,past
2058,The dolphins The dolphins seemed pretty intelligent .,past
2059,The knife The knife was dull .,past
206,The computer malfunctioned for the third time that day .,past
2060,The squirrels The squirrels annoyed me by walking in my path .,past
2061,Camels Camels walked across the horizon line .,past
2062,The cars The cars revved their engines in the parking lot .,past
2065,A butterfly A butterfly flew past the window .,past
2066,A toilet A toilet overflowed in the gas station 's bathroom .,past
2067,The bears The bears rummaged through the trash .,past
207,The towels were warm and fluffy .,past
2071,The light bulbs The light bulbs were all shattered .,past
2072,The dogs The dogs barked all night long !!! and I could n't sleep .,past
2073,A turtle A turtle slowly moved past my feet,past
2074,The guitar The guitar was broken .,past
2075,Cats Cats meowed outside my apartment window .,past
2077,Owls Owls hooted outside all night long .,past
2079,Marbles Marbles rolled across the floor .,past
2080,A fox ran through the field .,past
2081,The gorillas were the funniest at the zoo .,past
2082,The skunk sprayed the car .,past
2085,The kites soared in the sky .,past
2086,The dolphin swam around .,past
2088,The beds were never made .,past
2089,A boat sailed the sea .,past
2090,The kangaroo lept around .,past
2093,A squirrel had a nut .,past
2094,The couch was full of laundry .,past
2096,The owls hooted at night .,past
2099,The pig rolled in mud .,past
2101,Knives cut things .,past
2102,The butterfly was beautiful .,past
2104,The bears ate the apples .,past
2106,A marble rolled across the floor .,past
2107,A towel molded in the dryer .,past
2108,The lamps did n't work .,past
2111,The shirt was dirty .,past
2113,The pianos were tuned by a tuner .,past
2116,The tire went flat .,past
2118,The rabbits nibbled carrots .,past
2119,The bicycle had a flat .,past
2122,The fence fell down in the storm .,past
2124,A light bulb turned on .,past
213,The trumpet blared forth the fanfare .,past
2130,The owls sat in the tree looking wise and alert .,past
2132,The lamp created a lovely glow in the living room .,past
2134,The zippers were aligned perfectly on the jackets .,past
2135,Beds were made to sleep in not eat in .,past
2136,The clock was set for 9AM sharp .,past
2137,The butterflies landed on the nose of the Golden Retriever .,past
2140,The boats were at the dock unsailed .,past
2142,The fences kept out ll the unwanted neighbors .,past
2143,Bicycles were built for two in the 1800 's,past
2144,The chair was placed near the door as a lock .,past
2145,The football was kicked between the goal posts .,past
2146,The elephants walked across the plains in search of water .,past
2147,The gorillas were serious looking yet childlike and playful .,past
215,The fences ran across the rolling hills .,past
2153,A trumpet was used to sound the beginning of battle .,past
2156,The car was on the side of the road with a flat tire .,past
2160,The fox jumped over the lazy dog !!!,past
2161,The tires were flat and full of holes .,past
2164,The towels were still wet even after being in the dryer for forty minutes .,past
2166,Couches were meant for comfort .,past
2167,The light bulbs were not screwed in all the way .,past
217,The knife cut a generous slice of cake .,past
2172,The bed was shipped as requested .,past
2173,A piano was tuned before the show .,past
2174,A knife was stuck in the back of the body .,past
2176,A shirt was purchased as a gift .,past
2177,The peacocks strutted around the yard,past
2179,The television entertained the children .,past
2180,The shark circled the seal .,past
2181,Cows ate their cud .,past
2183,A kite was seen in the sky .,past
2184,The lamps lit the room .,past
2185,A kangaroo sniffed Jimmy .,past
2186,Toilets were unpluged .,past
2187,The towels were folded .,past
2189,Rabbits ate all my carrots,past
2190,The bicycle had a flat tire .,past
2191,The dog chased the car .,past
2193,An elephant watched as we drove by .,past
2194,The lions guarded the kill .,past
2196,The fence fell down due to disrepair .,past
2197,The butterflies bounced between the flowers .,past
2199,The dolphin followed the boat for several miles .,past
