id,sentence,tense/aspect
601,A boat floats on water .,present
602,Shirts are easy to put on .,present
603,The cow eats grass .,present
605,A kite flies high in the sky .,present
606,The pigeons eat seeds .,present
607,The gorilla beats his chest .,present
608,A camel has a hump .,present
609,The kangaroos jump around merrily .,present
61,A cheetah A cheetah is faster than a lion .,present
610,Guitars have a unique sound .,present
611,The toilets are on display .,present
612,A bed is a place to sleep .,present
615,Computers are fun to use .,present
616,The turtles swim in the pond .,present
64,A bicycle A bicycle is a convenient mode of transportation in the city .,present
65,Tires Tires carry the load of the vehicle .,present
66,Bears Bears hibernate for the winter months .,present
666,Dolphins are a weird mammal,present
667,A chair is a great place to sit,present
668,The panda is a very rare bare in the jungle,present
669,A turtle is very slow sometimes .,present
670,A piano is a great instrument .,present
672,The peacock is interesting !!! and very large .,present
673,Tires on the car are flat .,present
674,A pigeon lives ontop of the tree,present
676,The camels have weird teeth,present
677,A light bulb can burn out if they 're being used a lot .,present
678,Lamps in the room are n't bright enough,present
679,The guitar is a great musical instrument,present
68,Pianos Pianos are the primary instruments in churches .,present
682,The bicycles are on sale at the store .,present
683,Trumpets are great instruments,present
684,The couch in the living room has a cup holder on the side .,present
685,The gorillas are a great band,present
686,Rabbits hop very fast,present
687,The clock on the wall is ahead an hour .,present
690,Kangaroos kick very hard,present
691,A shirt keeps the body warm during the winter .,present
692,The televisions is big enough to watch games on .,present
694,A kite is up in the air very high .,present
695,Dogs are hard to maintain sometimes .,present
696,The squirrels collect nuts before winter .,present
697,Cars are very fast on the highway,present
698,The lion is the king of the jungle,present
7,The bed is unmade .,present
700,A bear hibernates in the winter .,present
703,A pig are very fast .,present
704,The towel is used to dry up after a shower,present
706,Fences help seperate properties in neighborhoods .,present
707,The beds at the hotel are very comfortable .,present
710,Toilets are needed in houses .,present
711,The footballs are great to throw around in the park .,present
714,Marbles are usually made out of glass .,present
716,A television is a big purchase .,present
719,The fences help to keep out the coyotes .,present
727,The lion is the king of Africa .,present
729,Owls are only awake at night .,present
73,Butterflies Butterflies emerge from their cocoon in summer .,present
730,Pigs are delicious and make great bacon .,present
732,A peacock has pretty feathers .,present
734,A bed is the best place to sleep .,present
735,The dolphins always travel together .,present
736,A boat floats on water and can have a sail or motorized engine .,present
738,Bears live in the forest .,present
740,Computers are helpful for completing tasks .,present
741,The piano is an instrument capable of great sound .,present
742,A toilet gets dirty and must be cleaned at least once a week .,present
746,Cows prefer to spend their time grazing fields .,present
749,Towels need to be laundered after being used .,present
750,Couches are great for lounging in .,present
754,Kites only fly on windy days .,present
757,The cars on the highway seem to be stuck .,present
759,A lamp has both an on and off position .,present
760,A camel is a tall animal .,present
761,The pigs roll in the mud .,present
762,A rabbit hops along .,present
763,The shirts are clean .,present
764,The television is turned on loudly .,present
765,The cow lives on a farm .,present
766,Pandas are cute animals .,present
767,Owls come put at night,present
768,A bed is very comfortable .,present
769,The guitars are great instruments .,present
771,A peacock has beautiful feathers .,present
772,The skunk stinks very much .,present
773,A towel is used after a shower .,present
775,The football is thrown by the boy .,present
777,The cheetahs run fast .,present
778,The gorillas are strong .,present
779,The piano is played daily .,present
780,The turtle swims in the ocean .,present
781,A clock runs all day .,present
782,Bicycles are fun to ride .,present
783,The kangaroos jump from side to side .,present
784,Sharks have sharp teeth .,present
785,Butterflies are beautiful .,present
786,Penguins choose one mate .,present
787,A trumpet is a loud instrument .,present
788,The fox runs quickly .,present
790,Light bulbs are used in lamps .,present
791,A bear lives in the woods .,present
792,The kite flies high in the sky .,present
794,Couches are made to sit on .,present
795,A cat is a friendly animal .,present
798,The pigeon is very messy .,present
799,The marbles roll around on the table .,present
800,A zipper is typically on jeans .,present
802,The fences are built well .,present
804,The computer is on constantly in our home .,present
805,Boats sail on the ocean .,present
809,The towels are for drying .,present
810,The lions are fierce .,present
814,The owl is wise .,present
815,Camels carry water in their humps .,present
816,The computers are great inventions .,present
817,The kangaroo jumps for a long distance .,present
818,A couch is a good place to sit .,present
821,Gorillas are large apes .,present
823,Pigs often live in mud .,present
824,The knives are sharp .,present
825,A bed is so comfortable .,present
826,The zipper joins two pieces of material .,present
827,The bicycles are good ways to exercise .,present
828,Footballs fill the air .,present
829,The pandas are fun to watch .,present
83,Lamps Lamps are the most common source of interior lighting .,present
830,A penguin is fun to watch .,present
831,The cheetah is a fast animal .,present
832,Toilets come in handy .,present
833,The tire has enough air .,present
834,The dolphin is a mammel .,present
836,Dogs are man 's best friends .,present
837,The butterflies are pretty .,present
838,A kite is fun to fly .,present
839,The lamp provides light .,present
840,The clock tells time .,present
841,The peacocks have pretty feathers .,present
843,The boat floats on the water .,present
844,Light bulbs provide light .,present
846,A turtle is slow .,present
847,Foxes are quick .,present
848,The elephant has a long trunk .,present
85,A panda A panda is a black and white bear native to Asia .,present
851,The marbles are for a game .,present
852,Cats are quiet !!! mostly .,present
853,The rabbits multiply frequently .,present
855,A lamp is placed in the corner of the room to give it a warm glow .,present
856,Clocks keep time and remind us of our immortality .,present
861,A couch is a very comfortable piece of furniture .,present
862,A zipper will often break before the pants wear out .,present
869,Beds are places to relax !!! dream !!! and unwind .,present
870,Towels are freshly supplied each afternoon .,present
872,A knife needs to be sharpened regularly .,present
878,A skunk is one of the worst animals to encounter .,present
88,Gorillas Gorillas are the smartest of the primates .,present
882,Footballs are made of leather and very durable .,present
884,Televisions are used to entertain people .,present
896,Penguins gather each year to breed and care for their young .,present
903,A television A television is attached above the fireplace .,present
904,A boat A boat is seen on the horizon .,present
905,The butterfly The butterfly begins as a caterpillar .,present
906,The cow The cow sometimes escapes from the farm pasture .,present
91,Squirrels Squirrels bury nuts around the forest .,present
910,The kangaroo The kangaroo protects its baby in its pouch .,present
920,A pig A pig makes some good bacon !,present
921,Bears Bears come down from the mountains and get into our trash .,present
925,A couch A couch sits on the curb awaiting garbage pickup .,present
927,The camels The camels carry contraband across the desert .,present
929,The lion The lion guards its family in the wilderness .,present
931,The footballs The footballs are made of plastic !!! not leather .,present
933,A peacock A peacock has very colorful tail feathers .,present
935,The tires The tires should be replaced when the tread wears down .,present
936,A zipper A zipper is used to close the purse .,present
937,The owl The owl watches the baby birds in hopes of a special meal .,present
938,Towels Towels are hung neatly beside the sink .,present
943,Marbles Marbles are used to play games by children .,present
948,The pandas The pandas are very playful at the zoo .,present
95,A shirt A shirt is required to go into the store .,present
950,A bed is soft .,present
951,Pigeons fly high,present
952,Knives are very sharp,present
953,The cars go fast,present
954,Shirts are short,present
955,The boat is very beautiful,present
956,The dolphin is beautiful,present
957,A kangaroo hops around,present
958,Sharks are dangerous,present
96,Foxes are very crafty .,present
960,A turtle is slow,present
961,Fences are sometimes necessary,present
962,The dog is fun,present
963,The pigs root around the lot,present
964,The rabbits hop around,present
965,The tire is very necessary,present
966,The butterfly is beautiful,present
967,A marble is a toy,present
968,A fox is interesting .,present
969,Guitars are nice,present
970,The toilet is very necessary,present
971,The kites fly high,present
972,The bears are dangerous,present
973,Skunks smell horrible,present
974,A football is a funny shape,present
975,The couch is soft,present
976,A bicycle has two wheels,present
977,The gorillas are huge,present
978,The computers are interesting,present
979,Cheetahs are funny,present
98,A cat likes to meow .,present
980,The televisions are interesting,present
981,A towel is necessary,present
982,The panda is cuddlely,present
983,The chairs matches the sofa,present
985,The penguin has short legs,present
987,Lamps are bright,present
988,Pianos are very nice,present
989,The light bulb is very bright,present
990,The squirrels eat nuts,present
991,A peacock struts around his cage .,present
992,Owls hoot at night,present
993,A zipper moves slowly,present
994,The elephant has a trunk,present
995,A camel has humps,present
996,Lions are dangerous,present
997,The clock keeps time,present
999,A dog is a good friend .,present
2648,Pigeons Pigeons had gathered around the man throwing bread .,past perfect
3030,The knives The knives had just been sharpened .,past perfect
3590,The televisions had been left on all night .,past perfect
1240,A gorilla A gorilla will defend it 's territory .,future
1478,A pig will be roasted at the BBQ .,future
1903,The cows will be slaughtered soon .,future
272,Foxes will eat your pets if you are not careful .,future
2758,A bear will eat people who are small,future
294,The sharks will bite a swimmer,future
304,A bear will steal the picnic basket,future
3433,A television will make you stupid .,future
3454,A rabbit will procreate rapidly .,future
720,A rabbit will hide from danger by staying still .,future
944,The rabbits The rabbits will reproduce quickly .,future
959,The cows will come home,future
1238,The turtles The turtles have outgrown their aquarium .,present perfect
1272,Tires Tires have gotten expensive .,present perfect
1489,Foxes have been seen around our neighborhood .,present perfect
1681,Dogs always have been man 's best friend,present perfect
210,Light bulbs have changed completely in technology in the past few years .,present perfect
2707,Sharks have attacked swimmers .,present perfect
2715,Owls have eaten several mice .,present perfect
2822,Peacocks have brightly colored feathers .,present perfect
3185,Pandas have forgotten how to reproduce .,present perfect
3455,The squirrels have attacked me before .,present perfect
3620,The beds have been made .,present perfect
3751,The bicycles have gone retro in style .,present perfect
3765,Light bulbs have changed so much in the past 20 years,present perfect
4150,Computers Computers have made communication easier .,present perfect
4192,The bicycle The bicycle has sat in the garage for two years .,present perfect
893,Peacocks have beautifully colored tails .,present perfect
1,The penguin is making me laugh .,present progressive
1050,The squirrel is gathering nut for the winter,present progressive
1051,Boats are floating in the lake,present progressive
1058,The rabbits are reproducing,present progressive
1098,A panda is eating bamboo,present progressive
1258,The toilet The toilet is overflowing !,present progressive
1269,The shirts The shirts are hanging on the line to dry .,present progressive
1273,The rabbits The rabbits are hopping across the front yard .,present progressive
1280,A penguin A penguin is waddling across the ice .,present progressive
13,An elephant is making noise outside .,present progressive
1382,The clocks The clocks are chiming,present progressive
1383,The kite The kite is flying high,present progressive
1384,A lion A lion is drinking water,present progressive
1393,The kangaroos The kangaroos are running,present progressive
1397,The pigeon The pigeon is eating,present progressive
1417,The squirrels The squirrels are eating,present progressive
1420,The dolphins The dolphins are swimming,present progressive
1432,A bear is crossing the road .,present progressive
1470,Kites are flying high today .,present progressive
1508,The kites are flying on the beach .,present progressive
1532,The piano is being fixed at the store .,present progressive
1533,The squirrels are gathering nuts for the winter .,present progressive
1535,The pigeon is waiting for crumbs to hit the floor .,present progressive
1541,The butterflies are migrating down to Bermuda now .,present progressive
1555,The cats are playing with the mouse .,present progressive
1562,The cars are going fast across the highway .,present progressive
16,Clocks are ticking in the background .,present progressive
1629,The lions are relaxing .,present progressive
1633,The fence is standing tall .,present progressive
1641,A tire is getting worn out .,present progressive
19,The foxes are hiding from the hunters .,present progressive
1936,The pianos are being tuned .,present progressive
2219,The clock is running five minutes behind .,present progressive
2223,The owl is hooting outside .,present progressive
2228,The pianos are playing in tantum .,present progressive
2234,The toilet is not working .,present progressive
2236,The bear is sleeping in the cave .,present progressive
2239,Foxes are being chased by the hounds .,present progressive
2240,The cat is chasing the mouse .,present progressive
2243,The butterfly is sitting on my finger .,present progressive
2249,The boats are sailing out for the race .,present progressive
2251,A towel is hanging up next to the shower .,present progressive
2252,The computer is running very slowly today .,present progressive
2255,A lion is roaring at the antelope .,present progressive
2261,The cow is giving fresh milk today .,present progressive
2262,The kangaroos are jumping in the field .,present progressive
2370,The camels are stopping to get a drink .,present progressive
24,Kites are flying in the wind .,present progressive
2425,Footballs are boring .,present progressive
2492,A towel is hanging in the bathroom .,present progressive
25,The squirrels are hiding the nuts .,present progressive
2633,The pandas The pandas are going extinct .,present progressive
2782,The lion is living in the den .,present progressive
2785,The pigs are wallowing in the mud .,present progressive
2786,Televisions are getting thinner and thinner .,present progressive
2792,An owl is sitting in the tree .,present progressive
2794,The bears are climbing up the tree .,present progressive
2811,Cars are becoming more fuel efficient .,present progressive
2873,Computers Computers are getting smaller .,present progressive
2911,The marbles are rolling all over the floor .,present progressive
2913,The elephant is eating peanuts .,present progressive
2915,A pig is rolling in the mud .,present progressive
2924,A shark is chasing the fish .,present progressive
2928,A guitar is playing on the song .,present progressive
2930,A clock is chiming .,present progressive
2931,The turtles are crossing the road .,present progressive
2935,The cars are waiting in line .,present progressive
2936,A shirt is hanging up to dry .,present progressive
2937,The bears are hibernating .,present progressive
2941,Kites are flying in the sky .,present progressive
2951,Cats are running through the yard .,present progressive
3220,Light bulbs are getting more efficient these days .,present progressive
3291,The bear is hibernating .,present progressive
3294,A squirrel is climbing up the tree .,present progressive
3303,The peacock is showing off its tail .,present progressive
3305,A boat is sinking .,present progressive
3307,A fox is sneaking into the henhouse .,present progressive
3319,A turtle is crossing the road very slowly .,present progressive
3427,The marbles are being lost everywhere .,present progressive
3441,The computer is wearing me out .,present progressive
3449,The kite is flying too high .,present progressive
3528,The toilet is not going to flush itself .,present progressive
353,The bicycles are getting used .,present progressive
3618,The television is not working .,present progressive
3621,The couch is sagging in the middle .,present progressive
3653,The toilets are flushing,present progressive
3779,Beds are becoming very high-tech .,present progressive
3788,The cheetah is running fast .,present progressive
3790,The owl is hooting .,present progressive
38,Cows are chewing their cud content to be alone .,present progressive
3800,The lions are eating meat .,present progressive
3803,The lamp is burning brightly .,present progressive
3806,The squirrel is gathering nuts .,present progressive
3816,The kites are flying in the sky .,present progressive
3817,A car is traveling fast on the road .,present progressive
3818,The bears are growling .,present progressive
3879,The turtles are swimming .,present progressive
3880,The cats are catching mice .,present progressive
3883,The clock is not working .,present progressive
3889,The squirrels are eating nuts .,present progressive
3892,The pigeon is eating off the side walk .,present progressive
3915,The kites are flying high .,present progressive
3951,Computers are ruining the world .,present progressive
40,The bear is moving closer to us .,present progressive
401,A toilet is running .,present progressive
4223,The squirrels are gathering nuts,present progressive
423,The pigeon is sitting on top of the building .,present progressive
4241,The bears are stealing picnic baskets,present progressive
4247,The rabbits are eating in the grass,present progressive
426,The cats are fighting in the alley .,present progressive
432,A clock is ticking .,present progressive
433,The kangaroos are hopping .,present progressive
434,The owls are hooting .,present progressive
436,The squirrel is running aroudn .,present progressive
441,The butterflies are flying .,present progressive
448,Kites are flying .,present progressive
449,A dog is barking .,present progressive
451,Toilets are running .,present progressive
456,The dolphins are playing .,present progressive
458,The penguins are enjoying the cold .,present progressive
466,The rabbit is hopping .,present progressive
47,A kangaroo is waiting in the corner .,present progressive
472,Sharks are eating people .,present progressive
474,The marble is rolling .,present progressive
477,The television is playing loud .,present progressive
6,Cats are circling the fishtank .,present progressive
671,The marbles are intersting toys,present progressive
8,The peacocks are showing off .,present progressive
849,A shirt is worn for looks and comfort .,present progressive
9,A dog is sleeping on the porch .,present progressive
1024,The trumpets were loud .,past
1072,Trumpets are noise and I do not like them,present
1081,Skunks smell awful when they get hit by a car,present
1090,A car is more dangerous than you think,present
1094,Footballs were being tossed,past progressive
1125,The clocks ticked and tocked,past
1138,The dogs barked and played,past
1144,The tire got flat while we were driving .,past
1157,Bears are dangerous when they are mad .,present
1162,The kangaroo had her baby in it 's pouch .,past
1237,The bear The bear roared at us because we got too close to it 's cubs .,past
1244,A kite A kite almost hit me as it crashed to the ground .,past
1252,A skunk A skunk sprayed my dog and now he smells horrible .,past
1259,A zipper A zipper that gets stuck is a huge irritation .,present
1276,The trumpets The trumpets are missing from the music room .,present
1278,The butterfly The butterfly likes my rose bushes .,present
1304,A chair is available if you need a seat .,present
1315,Marbles were something I used to collect .,past
1324,Trumpets blared loudly .,past
1335,Clocks Tick as time passes,present
1400,Trumpets trumpets are playing,present progressive
147,The shirts were dry now that they had been hung .,past
1498,The television is on but nobody is watching .,present
1499,An owl was hooting and woke me up .,multiple
1503,The couches were not exactly what I was looking for .,past
1538,Penguins always look like they are dressed up .,present
1552,Rabbits are very fast and found everywhere .,present
1558,The gorilla scares me when she stares at me .,present
1578,The tires spun as he drove down the highway .,past
1590,The trumpets blew loudly .,past
160,The trumpets blared to announce the king .,past
1674,The trumpet sounded like it was broken,past
1713,The gorilla beat his chest and looked angry .,past
1716,The sharks swam around the surfers !!! but did n't bother them .,past
1717,The guitar was completely out of tune !!! but the performer had no idea .,past
1721,The chair lost a screw when the man sat down .,past
1725,The butterflies danced around the puppy 's head !!! as he swatted at them playfully .,past
1729,The cat arched it back and meowed loudly .,past
1734,Shirts were made cheaply !!! but were low quality .,past
1736,The computers had to be repaired after the lightning struck .,past
1737,Turtles moved so slowly that it was almost imperceptible .,past
1739,Squirrels grabbed nuts and hid them away in their nest .,past
174,Penguins flapped around and jumped in water .,past
1746,A dolphin jumped into the air and waved its fin at us .,past
1747,The boat rocked side to side dangerously as the waves got bigger .,past
1748,The fence was so old that it was falling down .,past
1751,The cows chewed grass and looked bored .,past
1752,A pig squealed happily as he rolled in the mud .,past
1753,The foxes ran for their lives as the hounds fast approached .,past
176,The lions roared and fended off the hyena .,past
1773,The pigs ate and wallowed,past
1778,Gorillas ate lots of fruits and leaves,past
1793,A panda rolled over and played,past
1794,The clocks ticked and tocked all day,past
1809,Clocks ticked and chimed .,past
1813,The trumpets blew loudly .,past
1814,Owls hooted and flew away .,past
1815,The toilet overflowed and made a mess .,past
1842,A shirt read `` Peace is good . '',past
1932,The lamp fell and broke .,past
1935,Trumpets blared announcing the death of the king .,past
1949,The owls hooted as they took to the sky .,past
1952,Trumpets blared as the marching band marched across the field .,past
1966,Penguins dipped and dived into the cold water .,past
1969,The clock ticked and tocked as the minutes dragged on .,past
1977,A lion slept while a warthog and a meerkat foraged for food nearby .,past
1985,A tire blew out when it ran over a sharp object .,past
199,The lion roared and roared in the jungle .,past
201,A tire that is no longer useful for a vehicle makes a great swing .,present
2028,The rabbit went in it 's hole,past
2034,The bicycle The bicycle was tipped over and no one seemed to care .,past
2036,The tires The tires spun and spun in the mud .,past
2043,Cows Cows mooed as they were milked by the farmeres .,past
2050,Boats Boats sat in the harbor and bobbed up and down .,past
2053,The towel The towel was musty and smelled terrible .,past
2054,A football A football was tossed by the quarterback and landed in the stands .,past
2057,Pigeons Pigeons hopped up and down as I threw breadcrumbs down at them .,past
2068,The computer The computer started messing up !!! and I did n't know what to do .,past
2070,A zipper A zipper was pulled and his pants fell down .,past
2076,A chair A chair was tipped over on the floor after the fight ended .,past
2092,The trumpets were the loudest section .,past
2098,The computers never work when I need them to .,present
2149,A television set is where the family gathers in the evening .,present
2171,The panda is a solitary creature who has trouble mating .,present
2178,The guitars howeled as the cords were played .,past
219,Zippers are the best fastener for jeans because they are sturdy .,present
2203,A turtle snapped his jaws and ducked his head .,past
2214,The tires screeched as the brakes were applied .,past
2224,The dogs are barking because they are hungry .,present progressive
223,The marbles were beautiful and varied in color if one took the time to study them .,past
2245,A couch is where I take my naps .,present
