id,sentence,tense/aspect
2273,Owls stay up during the night and sleep in the day .,present
2277,Pianos can produce beautiful music is played properly .,present
2278,Footballs are fun to throw around .,present
2284,A zipper is a necessity on your blue jeans .,present
2286,A bed is a necessity for a good night 's sleep .,present
2287,Butterflies are pretty .,present
229,A bicycle is a convenient form of transportation .,present
2292,Lamps come in many different styles .,present
2294,A penguin is a cute creature .,present
2295,Rabbits are cute little critters .,present
2297,Bears are cute !!! but can be dangerous .,present
2299,Dolphins are very gentle creatures .,present
23,The tire is flat .,present
230,A television is a necessity for every household .,present
2306,A cat is my best friend .,present
2311,Dogs are great pets .,present
232,Peacocks are strange and beautiful birds .,present
233,A boat is useful for viewing whales and dolphins .,present
2349,Pandas are very cute animals .,present
2352,Cats are very playful after sniffing catnip .,present
2362,Clocks are part of every day life .,present
2363,The lion has a beautiful mane .,present
2364,A shirt is to be worn daily .,present
2368,A computer makes work more efficient .,present
2371,Chairs and desks are what make up the classroom .,present
2372,Toilets in the bathroom are dirty .,present
2373,The towel needs to be hung up to dry .,present
2375,Foxes are sly .,present
2377,A turtle wins the race because of persistence .,present
2378,The dolphins love to jump out of the water .,present
2379,Sharks are beautiful creatures .,present
2381,The gorilla is large and black .,present
2382,A pigeon is very intelligent .,present
2383,The guitars in the band are all the same color .,present
2384,Beds are made for sleeping on .,present
2385,The pianos are against the back wall .,present
2387,A bicycle has two wheels .,present
2388,The light bulb does not work .,present
2389,Couches are comfortable for relaxing .,present
2390,The skunks do not like to spray us .,present
2393,The pigs do truly stink .,present
2394,Elephants have long trunks .,present
2395,A penguin likes cold weather .,present
2398,The panda likes to eat eucalyptus .,present
2399,Cheetahs are the fastest animal on earth .,present
2400,An owl is wise .,present
2401,The lamps are overhead .,present
2403,The tires on the car are new .,present
2404,A cat chases a mouse right into the house .,present
2407,The cows give milk .,present
2408,A bed is cozy .,present
2409,The panda is a mammal .,present
241,Elephants are very intelligent and social .,present
2410,Cheetahs are scary .,present
2413,The couches are big .,present
2414,The fence is wide .,present
2415,Toilets flush loudly .,present
2416,The computer is quick .,present
2417,A car is great .,present
2418,The turtle is slow .,present
2419,The lamps are on .,present
2420,The fox is fast .,present
2421,An elephant is wise .,present
2422,A camel has two humps .,present
2424,A butterfly is pretty,present
2426,A chair is by the table .,present
2430,The skunks stinks .,present
2431,A bicycle does n't cost much .,present
2433,Light bulbs are fragile .,present
2434,A boat is in the water .,present
2436,Rabbits are cuddly .,present
2437,A dolphin is friendly .,present
2438,The guitar is in its case .,present
244,Bears hibernate in the winter .,present
2440,Pigs are funny .,present
2443,The piano is old .,present
2444,Tires are costly .,present
2447,The kite is high in the sky .,present
2448,Zippers are fast .,present
2449,A peacock has many feathers .,present
2453,Cheetahs are very fast .,present
2454,Kites fly better on a windy day .,present
2458,Fences make the yards in town look nicer .,present
2460,Squirrels eat nuts .,present
2461,The kangaroo likes to jump .,present
2464,The televisions are in the back of the store .,present
2467,Cows give milk .,present
2468,Turtles are slow .,present
2470,The peacocks look beautiful .,present
2472,Couches go mainly in the living room .,present
2474,The bears at the zoo seem playful .,present
2475,A boat is for travelling on water .,present
2483,A camel is for use in the desert .,present
2486,Pandas are a rare animal .,present
2489,The lions are the zoo 's top attraction .,present
2490,Footballs are not round .,present
2493,Camels dont need a lot of water,present
2494,Computers are important,present
2495,The clock is wrong,present
2496,The turtle is slow,present
2497,The skunks are stinky,present
2498,A marble is easy for a kid to swallow,present
2499,The guitars need to be tuned,present
2503,Lions are a pride,present
2504,An elephant is grey,present
2505,The bed is so cmfy,present
2506,A shirt has stains,present
2507,Tires go flat,present
2508,The pianos need to be tunes,present
2509,The pig goes oink,present
251,A kangaroo keeps its young in a pouch .,present
2510,A peacock has gorgeous feathers,present
2512,A fox kills a rabbit,present
2513,The lamps are on the table,present
2514,Cheetahs are fast,present
2515,The chair has four legs,present
2517,The owls are printed on my cup,present
2518,Kangaroos have pouches,present
2519,The cow gives milk,present
252,Footballs always end up in my flower bed .,present
2520,The penguins need cold,present
2522,A television costs more now,present
2523,A boat floats,present
2524,Bicycles are hard to ride,present
2525,Squirrels hoard nuts,present
2527,A pigeon is a nasty bird,present
2528,The rabbits multiply too fast,present
2529,A dolphin is a rapist,present
253,A fence helps with privacy .,present
2530,The footballs are flat,present
2531,The panda eats bamboo,present
2532,Fences need mending,present
2534,A guitar is a fun hobby .,present
2535,Clocks always tell me the time .,present
2536,A cat is a great companion animal .,present
2537,A football is fun to play with .,present
2539,Bicycles are a great way to exercise .,present
2541,Beds are perfect for a nap .,present
2545,The computer is a fun way to pass the time .,present
2547,Boats are a fun way to travel .,present
2548,A light bulb is easily replaced .4,present
2551,Butterflies fly freely throughout the day .,present
2552,The skunk stank badly .,present
2553,Zippers are really useful .,present
2554,The trumpets sound at my coming .,present
2556,Shirts can express who you are .,present
2557,The cars are a source of joy for me .,present
2558,A lion is the king of the jungle .,present
2560,The fence surrounds our property .,present
2565,Peacocks are showoffs by nature .,present
2570,The knives need to be cleaned .,present
2574,Penguins are such cool animals .,present
2575,An owl is an amazing animal .,present
2576,Dogs are a man 's best friend .,present
2579,Foxes are wily creatures .,present
258,A knife cuts through butter easily when it is hot .,present
2583,A bicycle is a great exercise option .,present
2584,Skunks make an awful smell when threatened .,present
2591,A panda is a rare sight these days .,present
2597,Light bulbs are not always energy efficient .,present
2598,The chair fits well with the other chairs at the table .,present
2599,Marbles are fun to play with and to collect .,present
26,A chair is overturned in the kitchen,present
2608,Cars are worth more new than used .,present
2617,Owls are nocturnal animals .,present
262,Trumpets are essential in a marching band .,present
2627,The butterfly effect is an interesting theory .,present
2630,A football A football is a piece of sports equipment .,present
2632,Lamps Lamps are a convenient lighting fixture .,present
2635,A cheetah A cheetah is one of the fastest land mammals .,present
2637,The computer The computer saves us a lot of time .,present
2639,The tires The tires are flat !!! we must replace them .,present
2640,A cow A cow is in the barn .,present
2641,Turtles Turtles are quite slow creatures .,present
2642,A chair A chair is a comfy addition to a desk .,present
2643,Sharks Sharks are dangerous predators of the ocean .,present
2644,Knives Knives are sharp and dangerous .,present
2650,A butterfly A butterfly floats gently on the breeze .,present
2652,The cat The cat is very fat .,present
2653,The televisions The televisions keep the people informed .,present
2657,Beds Beds are important for sleep quality .,present
2658,Couches Couches are a comfortable seat for multiple people .,present
2660,The cars The cars allows up to get form place to place easily .,present
2661,A toilet A toilet is to be used for relieving oneself .,present
2663,A zipper A zipper is a convenient way to close a sweater .,present
2666,A shirt A shirt is a torso covering commonly worn by humans .,present
2668,Skunks Skunks are smelly animals .,present
2669,An elephant An elephant never forgets .,present
2671,Dolphins Dolphins are among the most intelligent animals .,present
2672,A fox A fox is a sneaky animal .,present
2676,A dog with fleas is not healthy .,present
2681,Footballs are oblong .,present
2686,Chairs with arms are comfortable .,present
2699,Light bulbs produce heat .,present
27,The boats are in the harbor .,present
2701,A panda likes to eat bamboo .,present
2706,A piano needs to be periodically tuned .,present
2716,A marble floor is exquisite .,present
2720,A kangaroo carries young ones in a pouch .,present
2721,The kite has no tail .,present
2724,A trumpet is noisy,present
2725,A shirt is nice,present
2728,Dogs eat cats,present
2731,Marbles are tradeable,present
2737,An elephant is a fat animal,present
274,Lions live in prides .,present
2740,Clocks go back soon,present
2744,The skunk stank up the house,present
2745,Zippers always break,present
2746,The cows give milk,present
2747,A rabbit eats carrots,present
2748,Turtles are good in soup,present
2749,A lamp is electric,present
2751,Televisions are fun to watch,present
2752,The piano has 88 keys,present
2753,A pigeon carries letters,present
2754,Cats are used in Chinese cuisine,present
276,The dolphins prefer to live in the ocean .,present
2764,Gorillas are big,present
2766,A car goes varoom,present
2767,Light bulbs screw into light sockets,present
2768,A squirrel eats nuts,present
2770,A towel is for drying hands .,present
2772,The peacocks have gorgeous tails .,present
2773,The piano has black and white keys .,present
2774,Dolphins are very smart mammals .,present
2777,The pandas come from China .,present
2779,Marbles come in all different colors .,present
2781,A boat is made to float on the water .,present
2787,The turtle has a very hard shell .,present
2788,A skunk is a smelly animal .,present
2789,The tires are made of rubber .,present
2790,The gorilla is an ancestor of humans .,present
2793,Pigeons are settled in the coop .,present
2795,Computers are a miraculous invention .,present
2796,A kangaroo carries its young in a pouch .,present
2798,A couch has soft cushions .,present
2799,Rabbits multiply very quickly .,present
28,A couch is for sitting .,present
2801,The clock is no longer working .,present
2802,Knives and forks are for eating .,present
2805,The fence needs to be painted .,present
2806,A cat is an independent animal .,present
2807,Foxes are hunted by men on horses .,present
281,Rabbits breed like !!! well rabbits .,present
2810,A trumpet is a brass instrument .,present
2813,An elephant is one of the largest mammals in the world .,present
2814,The bicycles are all rusted .,present
2815,Cheetahs are very fast cats .,present
2816,The guitars are stringed instruments .,present
2819,A panda looks very cuddly .,present
2821,A football is not really made of pigskin .,present
2825,A squirrel has a bushy tail .,present
2831,A trumpet is a musical instrument .,present
2838,The piano is in need of tuning .,present
284,A camel walks across the desert .,present
2841,Bears live in the woods .,present
286,The light bulb needs changing . .,present
2860,A toilet requires weekly cleaning .,present
2861,Lamps are needed in dark places .,present
2863,The shark The shark is a great white .,present
2864,The toilets The toilets are broken .,present
2865,A cat A cat is furry .,present
2866,Butterflies Butterflies are pretty .,present
2867,The kite The kite is in the sky .,present
2868,The foxes The foxes are sly .,present
2869,Bears Bears love beats .,present
2870,The cows The cows go moo .,present
2871,The knives The knives are in the kitchen .,present
2872,A penguin A penguin is black and white,present
2874,A clock A clock tells time,present
2875,The kangaroo The kangaroo is tall .,present
2876,The television The television is loud .,present
2877,The lamps The lamps are brights .,present
2878,The tires The tires are new .,present
2879,Pianos Pianos have keys .,present
288,The chair is pushed under the table,present
2880,A chair A chair is used to sit in .,present
2882,Cars Cars are expensive .,present
2885,A lion A lion has a mane .,present
2886,The towel The towel is wet .,present
2887,Skunks Skunks stink .,present
2888,The dolphin The dolphin lives in the sea .,present
2889,The cheetah The cheetah is fast .,present
289,The pigs are one of the smartest animals,present
2892,Pigs Pigs are cute .,present
2893,The boats The boats are in the harbor .,present
2894,A panda A panda is black and white .,present
2895,Footballs Footballs are brown .,present
2896,Gorillas Gorillas are smart .,present
2897,A marble A marble is round .,present
2898,The owls The owls wake up at night .,present
2899,The guitar The guitar is out of tune .,present
29,The cheetah runs really fast .,present
2900,Elephants Elephants never forget .,present
2901,A shirt A shirt is needed to eat there .,present
2902,The camels The camels are brown .,present
2903,Light bulbs Light bulbs are cheap .,present
2905,The couches The couches are comfortable .,present
2906,The dog The dog is happy .,present
2907,A peacock A peacock has many colors .,present
2908,The bicycle The bicycle has a flat tire .,present
291,A bicycle has two wheels and a seat,present
2910,Towels are in the closet .,present
2914,Beds need to be made .,present
2916,Computers need to be updated .,present
2917,A zipper is in the back .,present
2918,The toilets need to be cleaned .,present
2919,The cheetahs are super fast .,present
292,The skunk stinks real bad,present
2920,Camels have humps .,present
2921,The lions are the kings .,present
2925,The pandas are super cute .,present
2926,Foxes are dirty animals .,present
2927,The televisions are on sale .,present
2929,The kangaroo has a baby in her pouch .,present
293,The toilets need to be cleaned often,present
2934,Penguins have happy feet .,present
2938,The boat is on course .,present
2939,Chairs need to be stacked .,present
2942,The owl is nocturnal .,present
2943,The pigeons are everywhere .,present
2945,A lamp is on the table .,present
2948,Dolphins live in the ocean .,present
2949,The fence is too tall to see over .,present
295,A bed is part of my bedroom,present
2950,The couches need to be shampooed .,present
2952,A skunk lives under our porch .,present
2953,The pianos need to be tuned .,present
2954,Marbles marbles roll easily,present
2958,Couches couches are expensive,present
296,The squirrels eat nuts while sitting in the tree,present
2966,Foxes foxes are sly,present
297,Tires are made of rubber,present
2979,Sharks sharks eat people,present
298,Zippers are used to close to pieces of fabric .,present
2982,Penguins Penguins wabble,present
2984,Towels towels are nice for drying off,present
2989,Kangaroos kangaroos kick well,present
299,The marbles are colectable by kids,present
2991,A television a television is a luxury,present
2994,The pigs the pigs are pink,present
2996,Peacocks Peacocks have feathers,present
2997,A dolphin A dolphin is smart,present
3,A computer is needed in today 's world .,present
300,A knife is used to cut meat,present
3001,The elephants The elephants are not forced to paint pictures because that would be animal cruelty .,present
3003,Dogs Dogs are comforting animals .,present
301,The camel uses his humps to conserve water,present
3011,A guitar A guitar is a good companion for a lonely soul .,present
3018,Rabbits Rabbits are quick to run .,present
302,Towels are used to dry the dishes,present
3027,Light bulbs Light bulbs are on aisle five .,present
303,The clock tells time,present
3032,Kangaroos Kangaroos are from Australia .,present
3040,A piano A piano is a beautiful instrument .,present
3042,Lions Lions are the kings of the jungle .,present
3046,Gorillas Gorillas are magnificent creatures .,present
3048,The footballs are shaped like olives .,present
3049,A marble is fun to play .,present
305,The shirts has coloful pictures painted on them,present
3050,A bicycle runs fast .,present
3051,A piano is fun to play .,present
3052,The gorilla is big and black .,present
3053,The lamp turns on .,present
3055,A rabbit runs fast .,present
3056,The dogs are man 's best friend .,present
3057,The bear has a large claw .,present
3058,Pigeons are messengers .,present
3059,Pandas love to eat bamboo .,present
306,Elephants never forget,present
3060,A skunk smells bad .,present
3061,Toilets are made of porcelein .,present
3062,The squirrel has acorns .,present
3063,The owls go hoot .,present
3064,The tires are wide .,present
3066,The televisions are fun to watch .,present
3069,The cat runs from the dog .,present
307,Cows have large eyes,present
3070,An elephant is very large .,present
3071,The kangaroos are good at boxing .,present
3072,The kite flies high .,present
3073,A lion roars loudly .,present
3074,Light bulbs go on and off .,present
3075,The guitar sounds good .,present
3076,The camel has two humps .,present
3077,Clocks keep track of time .,present
3078,The pigs are noisy .,present
3079,A fence goes around a room .,present
308,The light bulb is not energy rated,present
3080,A cow goes `` moo . '',present
3081,Chairs are comfortable .,present
3082,The peacocks are majestic .,present
3083,A bed gives rest .,present
3084,The couch is very comfortable .,present
3085,Dolphins are smart .,present
3086,The zippers zip up jackets .,present
3087,The turtle moves slowly .,present
3088,A cheetah runs fast .,present
3089,The sharks are scary .,present
309,Pigeons are a really smart bird,present
3090,The computer is useful .,present
3091,The shirts are white .,present
3092,A towel is dry .,present
3093,Butterflies are in my stomach .,present
31,Gorillas are primates,present
311,A dolphin swims in the ocean,present
312,The lamps are tuned on at night,present
3122,The owls MADE NOISES IN THE NIGHT .,present
313,A lion is the kind of the jungle,present
314,The gorillas are large and scary,present
3143,Marbles make marvelous toys .,present
3144,Elephants use their trunks to eat large melons .,present
3146,A computer processes millions of commands per second .,present
3149,Owls are nocturnal birds .,present
315,Cars are used as transportations,present
3150,The kangaroo cares for its baby .,present
3151,The bear tries to catch salmon .,present
3152,Turtles are often confused with tortoises .,present
3156,A cheetah runs faster than a puppy .,present
3158,A dog barks all night .,present
316,A cheetah runs fast,present
3160,Televisions sell better at Christmas than Father 's Day .,present
3162,A couch makes a terrible bed .,present
3164,Clocks sometimes chime the hour .,present
3165,The gorilla struggles to escape its cage .,present
3167,The lion stalks its prey .,present
3169,A boat sinks slowly in the sea .,present
3170,The cats are on the roof .,present
3171,The trumpets blare while bombs burst in the air .,present
3175,Pigs eat slop and live in mud .,present
3177,The towel is an essential item to carry at all times .,present
3178,Peacocks preen their feathers .,present
318,The guitar has wire strings,present
3180,Beds are very comfortable .,present
3182,A chair belongs at a desk .,present
3183,The foxes say `` Ring-ding-ding-ding-dingeringeding '' !,present
3186,A lamp or a torch are the most common light sources for dungeoneering .,present
3188,Penguins live in arctic regions .,present
3189,A zipper closes the jacket .,present
319,Televisions are in just about everyone home in america,present
3192,Owls are excellent hunters .,present
32,The lamps are all on .,present
320,A rabbit lives in my backyard,present
3201,The clock keeps on ticking .,present
3203,A knife is a good tool to bring camping .,present
3209,Pianos need to be tuned every so often .,present
3210,The camel is a good way to travel in the desert .,present
3213,The gorilla is an amazing jungle animal .,present
3215,The bed is very soft and comfortable .,present
3218,A chair on the porch is a good idea .,present
322,The panda eats bamboo everyday,present
3224,Boats are all over the harbor these days .,present
3225,Kangaroos have a pouch to carry their young .,present
3226,A computer screen is hard to stare at for long .,present
3228,A pig enjoys being sloppy .,present
3229,Trumpets sounded at the return of the prince .,present
3232,Bears protect their cubs violently .,present
3235,A fence keeps the dog out,present
3238,Beds are for sleeping,present
324,A piano is used to write and create music,present
3241,The lion is the king of the Sahara,present
3242,Camels are great creatures,present
3243,The toilet smells badly,present
3244,The rabbits make good stew,present
3247,Guitars are loud,present
3248,A cheetah runs really fast,present
325,The kangaroo hops all over the town,present
3250,Penguins are birds,present
3251,A shark regrows its teeth,present
3259,A bear is scary,present
326,Peacocks has pretty feathers,present
3268,A computer is my lifeline,present
327,A kite flys high and tangles in tree,present
3274,A dolphin is a mammal,present
3275,Pigeons fly above the crime scene,present
3281,A squirrel makes for good eatin,present
3283,The cheetahs run fast when they hunt .,present
3284,Pandas are very rare .,present
3286,Beds are often uncomfortable .,present
3288,The light bulbs need to be changed .,present
329,Fences keep out the dogs,present
3290,The chairs are all old and broken .,present
3292,Skunks will spray you if they are angry .,present
3293,The lion is in the zoo .,present
3296,A cat is hunting for mice .,present
3297,The fence needs to be repainted .,present
3299,The shirts need to be washed .,present
33,The fence has a hole in it .,present
330,A cat licks his fur,present
3300,Trumpets are often found in brass bands .,present
3301,A guitar is used to make music .,present
3302,The towels hang from a rack in the bathroom .,present
3304,The owl flies at night .,present
3306,The elephants stroll across the savanna .,present
3309,Tires should be changed when they become bald .,present
331,The turtles return to there nest site every year,present
3310,A dog barks in the night .,present
3311,The pigs are very dirty .,present
3312,The bicycle needs to be fixed .,present
3313,Pianos are very expensive to buy .,present
3314,The kites are in the sky above the park .,present
3316,The computer is on the desk .,present
332,The computer is part of my everyday life,present
3320,The couch is in the living room .,present
3321,The shark attacks the swimmer .,present
3322,Pigeons eat bread in the park .,present
3323,A clock strikes twelve .,present
3324,The televisions are on .,present
3325,The rabbits steal vegetables from the garden .,present
3326,A lamp is useful to have in the dark .,present
3327,The toilet is clogged .,present
3328,The camels are very thirsty .,present
333,A couch is used to sit and relax after a long day,present
3330,The owl says HOO at night,present
3332,The beds are soft,present
3334,The bear looks for food,present
3335,Boats float away,present
3336,An elephant is a large mammal,present
3337,A computer gives useful information,present
3338,The fox is very sly,present
3339,Televisions show enetertainment,present
334,The fox is clever,present
3340,The fences stand solid,present
3341,The kangaroos jump a lot,present
3343,A shirt is wrinkled,present
3344,Dolphins act funny,present
3346,The lamp is bright,present
3347,The lion looks for his next kill,present
3348,The skunks sometimes stink,present
3349,A butterfly flies smoothly,present
3350,The toilet has water,present
3351,Marbles roll smoothly,present
3352,The cheetahs enjoy the kill,present
3354,Camels travel in the desert,present
3356,Light bulbs make great visibibity,present
3357,A peacock has many bright colors,present
3358,The couches are soft and comfortable,present
3359,A guitar sounds nice,present
3360,The chairs are arranged,present
3361,Pandas are black and white,present
3362,A knife is sharp,present
3363,The dog looks for directions,present
3364,The sharks swim smoothly,present
3365,A pigeon lives in the city,present
3366,The tire needs to be replaced,present
3367,A piano makes beautiful music,present
3369,The car runs well,present
337,The toilets need some scrubbing .,present
3370,A pig likes the wet mud,present
3371,The clock shows time,present
3378,A peacock has lots of pretty feathers .,present
3379,The rabbit hopped out of it 's hole .,present
338,Kangaroos are native to Australia .,present
3384,A toilet is in the bathroom .,present
339,The dolphins swam with the humans .,present
34,The shirts are all wrinkled .,present
340,An elephant has a good memory .,present
3400,A butterfly is majestic .,present
3401,Knives are very sharp .,present
3402,A football is brown .,present
3412,Beds are comfortable .,present
3421,The turtles are idolized by many peoples .,present
3423,Lamps give off light .,present
3425,The beds are not just for sleeping .,present
